titre,description,type_stage,duree,remuneration,format,secteur,ville_nom,responsabilites,profil_recherche,status,date_debut,date_fin,company_email
Développeur FullStack,Stage technique sur Laravel et Vue.js,Technique,3 mois,Non-payé,Hybride,Informatique,Tanger,"Développer des modules API|Intégrer les maquettes Figma","Connaissance de Laravel|Autonomie","Active",2026-06-01,2026-08-31,contact@manpower.ma
Stage PFE Data Science,Analyse de données massives pour l'industrie,PFE,6 mois,Payé,Présentiel,Industrie,Casablanca,"Nettoyage de données|Modélisation prédictive","Python (Pandas/Scikit-learn)|Étudiant Bac+5","Active",2026-04-01,2026-09-30,hr@ocp.ma
UX/UI Designer,Conception de parcours utilisateurs innovants,Observation,1 mois,Non-payé,Télétravail,Design,Casablanca,"Audit UX|Création de prototypes","Maîtrise de Figma|Créativité","Active",2026-05-01,2026-05-31,talent@capgemini.com
Analyste Financier,Support aux équipes de gestion de risques,Technique,4 mois,Payé,Présentiel,Commerce,Casablanca,"Analyse de bilans|Reporting financier","Formation Finance/Comptabilité|Rigueur","Active",2026-07-01,2026-10-31,contact@attijari.ma
Administrateur Systèmes,Maintenance de l'infrastructure réseau,Technique,3 mois,Non-payé,Hybride,Informatique,Rabat,"Support technique|Gestion des serveurs","Linux|Cisco|Dynamisme","Active",2026-06-15,2026-09-15,hr@iam.ma
